{
  "schema_version": 1,
  "families": [
    "typographic",
    "editorial",
    "expressive",
    "photographic",
    "tactile",
    "technical",
    "restrained",
    "functional",
    "illustrative",
    "nostalgic",
    "ornamental",
    "spatial",
    "commercial"
  ],
  "tags": [
    "grid",
    "asymmetric",
    "reading-led",
    "poster",
    "image-led",
    "handmade",
    "monospace",
    "minimal",
    "geometric",
    "annotated",
    "task-led",
    "cutout",
    "data-led",
    "archival",
    "metallic",
    "decorative",
    "typographic-motion",
    "dimensional",
    "product-led",
    "humanist",
    "warm",
    "high-contrast",
    "calm",
    "playful",
    "precise",
    "cinematic",
    "luxury"
  ],
  "use_cases": [
    "services",
    "portfolio",
    "publishing",
    "campaign",
    "travel",
    "craft",
    "culture",
    "hospitality",
    "public-information",
    "events",
    "data",
    "products",
    "commerce",
    "personal",
    "documentation",
    "architecture"
  ]
}
